<?xml version="1.0" encoding="UTF-8"?>
<!DOCTYPE Aeroport SYSTEM "aeroport.dtd">
<Aeroport>
    <Employes>
        <Employe>
            <NomEmploye>Dupont</NomEmploye>
            <Prenom>Jean</Prenom>
            <Age>34</Age>
            <Poste>Technicien</Poste>
            
        </Employe>
    </Employes>    
    <Pistes>
        <Piste>
            <NomPiste>Nord</NomPiste>
            <Longueur>3500</Longueur>
            <Etat>Disponible</Etat>
        </Piste>
    </Pistes>
    
    <Compagnies>
        <Compagnie>
            <NomCompagnie>Air France</NomCompagnie>
            <Pays>France</Pays>
        </Compagnie>
    </Compagnies>
    
    <Avions>
        <Avion>
            <Modele>Airbus A320</Modele>
            <CompagnieRef>Air France</CompagnieRef> 
            <Capacite>180</Capacite>
        </Avion>
    </Avions>
    
    <Vols>
        <Vol>
            <Numero>AF1234</Numero>
            <AvionRef>Airbus A320</AvionRef>
            <Depart>Piste Nord</Depart>
            <Arrivee>Piste Sud</Arrivee>
            <Heure>08:30</Heure>
            <Destination>Paris</Destination>
            <Date>2024-11-15T08:30:00Z</Date> 
            <Piste_vol>Piste Nord</Piste_vol>
            <PiloteId>123</PiloteId>
            

        </Vol>
    </Vols>
</Aeroport>
